ID Cliente,Producto,Calificación,Comentarios
36,Gofio,5,Skin commercial total organization course.
25,Queso Majorero,5,Soldier ready person politics too.
29,Dulce de Membrillo,1,Wait often all tree.
48,Vino Tinto Canario,1,Including wide include within person sport picture.
86,Gofio,3,Standard political side run particularly father.
41,Dulce de Membrillo,5,Like occur research staff member provide myself beat.
32,Queso Majorero,4,Such small take always.
95,Aceite de Oliva,5,Small thus to shoulder management car religious.
72,Queso Majorero,4,Feel size important film.
12,Vino Tinto Canario,4,Land cold language business section land try.
52,Queso Majorero,2,Staff human fish prove tough force thank.
38,Aceite de Oliva,1,Growth south mother form enter carry.
64,Gofio,2,Consider take say.
57,Aceite de Oliva,5,Him politics outside black father kind though.
59,Queso Majorero,3,Best cell office control fill wear part.
22,Vino Tinto Canario,3,Stay sing station him old.
46,Dulce de Membrillo,2,Sport news five son no what article sport.
34,Gofio,4,Among term green Republican bed including turn.
58,Dulce de Membrillo,3,Be church maybe wait.
81,Vino Tinto Canario,5,Determine traditional son interview chair manage.
64,Aceite de Oliva,5,Head south before remain some long.
70,Gofio,4,Together would consider them career magazine.
26,Gofio,5,Notice force as action word sort that.
38,Queso Majorero,2,Spend picture past indicate authority couple.
40,Aceite de Oliva,5,Success present factor month current admit.
13,Aceite de Oliva,3,Finish model administration store party subject why.
58,Gofio,3,Value exactly feeling painting.
61,Vino Tinto Canario,2,Air do either player opportunity sea road experience.
63,Queso Majorero,5,Over fight southern question wrong you president.
58,Gofio,4,Improve father final situation offer.
84,Queso Majorero,2,Nice direction sense option perhaps.
40,Aceite de Oliva,3,Simple produce discover space task follow.
65,Dulce de Membrillo,4,Positive color worker hotel memory scene.
3,Queso Majorero,5,Whole kind upon south nothing maintain magazine.
54,Aceite de Oliva,3,Series fish their worry.
11,Aceite de Oliva,3,Wonder hear physical after before.
76,Gofio,3,Town certainly purpose recognize reality.
94,Queso Majorero,3,Fact opportunity north decade event whatever.
75,Aceite de Oliva,5,Involve hold customer.
77,Aceite de Oliva,1,Ready another more represent yard small.
31,Vino Tinto Canario,1,Main big special of despite simple.
80,Vino Tinto Canario,3,Move bad foot evidence.
33,Queso Majorero,1,Stuff enter man work always wish.
37,Dulce de Membrillo,1,Reach kitchen join view learn.
2,Dulce de Membrillo,5,Cold very four data center decade good music.
100,Vino Tinto Canario,1,Hospital reduce worry health your wife.
12,Vino Tinto Canario,4,Kitchen financial care.
13,Queso Majorero,2,Inside money expect detail although.
98,Aceite de Oliva,2,Often listen culture instead sometimes single citizen.
51,Dulce de Membrillo,1,Him place early collection attorney enjoy check.
5,Dulce de Membrillo,1,Wish pick leave.
95,Dulce de Membrillo,2,Series executive suggest one.
99,Gofio,1,Already top window at health tax night.
76,Aceite de Oliva,4,Design send number low most ground organization consumer.
43,Vino Tinto Canario,2,Little audience born chair do.
4,Gofio,3,Wait total treat turn window religious firm return.
69,Dulce de Membrillo,3,Shoulder anyone four street car.
71,Gofio,3,Deep laugh major herself yard require until.
18,Vino Tinto Canario,2,Among force ahead trouble laugh.
70,Gofio,3,Gun consumer against its investment.
64,Aceite de Oliva,4,Current especially think.
43,Vino Tinto Canario,1,Recognize cultural field.
90,Aceite de Oliva,3,Data both painting million role.
12,Dulce de Membrillo,2,Treat drive when exist account.
30,Queso Majorero,5,Half leader kid appear crime good paper.
27,Dulce de Membrillo,4,Son scene say simple small feeling third.
66,Queso Majorero,5,Today speech fish Congress teach yet.
66,Dulce de Membrillo,2,Test cell table eye.
78,Dulce de Membrillo,2,She number popular government opportunity would true.
6,Vino Tinto Canario,5,For catch paper.
70,Gofio,3,Increase hour political end serve reason song.
8,Vino Tinto Canario,2,Research reflect people report security term experience between.
21,Queso Majorero,3,Like manage kind.
74,Aceite de Oliva,2,Almost understand short industry big think want bill.
93,Vino Tinto Canario,2,Student detail white.
9,Aceite de Oliva,5,Tell news hard out list hard.
42,Dulce de Membrillo,1,Technology tax avoid over rise compare word.
11,Dulce de Membrillo,2,Contain modern heavy international positive staff.
28,Gofio,1,Imagine city challenge building member.
5,Gofio,2,Model pass decide wall.
100,Queso Majorero,1,Risk service indeed room season responsibility.
98,Aceite de Oliva,4,Mouth if check concern major upon quite.
32,Vino Tinto Canario,4,Treat view although listen.
20,Queso Majorero,5,Tough before relate.
1,Gofio,2,Trouble past various happen.
43,Dulce de Membrillo,5,Buy receive weight past court.
16,Gofio,4,Popular culture use writer truth three.
58,Aceite de Oliva,3,Fast serious arrive take politics just catch.
1,Queso Majorero,2,Mr tonight my.
58,Dulce de Membrillo,4,School lose along.
75,Queso Majorero,4,Try crime bit attorney letter rather quite.
39,Vino Tinto Canario,3,Air behind himself step character impact.
56,Dulce de Membrillo,4,Well draw wind rule begin information whole reveal.
64,Aceite de Oliva,1,Often new eight realize.
59,Gofio,2,Catch here with strategy discover actually.
21,Gofio,4,Positive cost adult lead trial front animal.
5,Queso Majorero,5,Cell bar writer standard appear him grow.
93,Queso Majorero,4,Capital list truth majority mention wide.
36,Gofio,4,Resource media site want human stop manager.
55,Aceite de Oliva,5,Art choose safe hospital foreign easy.
