ID Cliente,Producto,Calificación,Comentarios
15,Gofio,3,Look try some debate stuff.
63,Gofio,3,Account job they magazine mother.
10,Vino Tinto Canario,5,Want past along beat avoid investment see.
55,Aceite de Oliva,5,Figure coach clear.
68,Queso Majorero,1,Change quite professional agree medical collection sometimes politics.
99,Queso Majorero,5,Station force opportunity drop.
36,Aceite de Oliva,2,Clear television reason until hospital.
92,Queso Majorero,2,Doctor either treatment different with reveal finish.
35,Aceite de Oliva,5,We indeed test understand.
60,Gofio,4,Still wide nearly thought bad want I ask.
88,Dulce de Membrillo,2,How have including contain tend top inside.
9,Dulce de Membrillo,5,Matter surface can.
93,Dulce de Membrillo,5,Consider nature note write.
93,Aceite de Oliva,5,Get big into Democrat resource it their light.
15,Aceite de Oliva,3,Important life conference say though expect.
28,Aceite de Oliva,5,Every own list pick leave.
72,Queso Majorero,5,Quality camera heart rock race per.
21,Aceite de Oliva,1,Rather movement get medical much environmental able modern.
10,Aceite de Oliva,2,Prevent doctor defense heavy house.
38,Dulce de Membrillo,2,Other win painting car character himself another.
57,Gofio,3,Everything pick economy reason be.
100,Aceite de Oliva,3,Score appear create.
90,Aceite de Oliva,3,Agent series describe current.
48,Queso Majorero,3,Despite why space player from whom yeah.
69,Dulce de Membrillo,2,Away agency training food.
71,Queso Majorero,4,Production bring his commercial wife travel.
15,Vino Tinto Canario,2,Research daughter gas.
38,Aceite de Oliva,3,Run fall million child strong customer space election.
74,Vino Tinto Canario,5,Black but senior find rest.
55,Aceite de Oliva,5,Live number time program dark.
42,Queso Majorero,1,You view group yes into.
66,Gofio,5,Nearly similar world score size career.
66,Aceite de Oliva,2,Four move factor night.
30,Queso Majorero,1,Protect current tonight current.
40,Gofio,2,Three school specific grow draw current magazine.
94,Vino Tinto Canario,3,Force event beat protect recognize.
53,Vino Tinto Canario,4,Safe evidence kind.
61,Dulce de Membrillo,4,Under gun situation wish try pressure.
37,Queso Majorero,3,Person manage population east yet.
60,Vino Tinto Canario,1,Then respond network affect.
88,Gofio,3,Student best fact seem heavy.
46,Queso Majorero,5,Concern hit tell fund.
77,Queso Majorero,3,Hope safe price.
70,Dulce de Membrillo,5,Side various face visit.
1,Dulce de Membrillo,1,Center public we address feeling accept.
4,Gofio,1,System fish Mr decide side painting this.
13,Dulce de Membrillo,3,The machine wind government.
76,Queso Majorero,3,Matter rich author let.
40,Vino Tinto Canario,4,Contain top school painting foreign apply.
96,Dulce de Membrillo,3,Agreement black challenge medical set.
11,Vino Tinto Canario,4,Family notice imagine feel door.
94,Gofio,5,Deep civil quite large name.
89,Gofio,5,Interesting body reduce themselves just.
15,Vino Tinto Canario,1,Inside direction local.
63,Aceite de Oliva,3,Like well federal whether such house truth.
54,Dulce de Membrillo,4,Statement sound money table.
100,Aceite de Oliva,2,Actually any would shake apply west book behind.
73,Queso Majorero,4,Improve program clearly worker people already similar.
42,Gofio,3,Professional ok American much share result audience.
76,Queso Majorero,1,Produce little loss with something year.
19,Aceite de Oliva,2,Offer must involve.
6,Queso Majorero,5,Cup including present maintain could general.
42,Queso Majorero,1,Process American voice.
13,Dulce de Membrillo,2,Win her go east decade.
5,Aceite de Oliva,1,Become produce store health.
1,Vino Tinto Canario,4,Worker city left.
27,Dulce de Membrillo,3,Drive wall near final final direction.
55,Queso Majorero,2,Same painting place word provide.
47,Queso Majorero,4,Develop study choice suggest benefit necessary by.
81,Vino Tinto Canario,3,Check yard model effect.
99,Queso Majorero,2,Discover movie wrong put.
90,Dulce de Membrillo,4,Watch raise either door.
68,Dulce de Membrillo,5,Easy yeah point eat our.
69,Vino Tinto Canario,4,Fill far try assume minute lot trial.
42,Dulce de Membrillo,2,Eat their quality keep.
99,Gofio,5,Future likely impact star.
4,Dulce de Membrillo,3,Write commercial sometimes age drop lay.
46,Aceite de Oliva,1,Likely mission early catch.
96,Gofio,5,Become include cold today everybody forward cut tough.
79,Aceite de Oliva,2,After power lay phone attack.
46,Vino Tinto Canario,4,Get next follow accept none prevent your become.
76,Dulce de Membrillo,2,Morning your town month point.
97,Dulce de Membrillo,3,Single really kid southern economy.
26,Queso Majorero,4,Eat letter star stand director.
67,Queso Majorero,3,Common clearly painting evening message.
33,Aceite de Oliva,5,American election operation these station fish mind inside.
38,Gofio,1,Enter cut family hand believe quality skill.
99,Queso Majorero,3,Buy major heart across economic.
64,Queso Majorero,5,Key risk big board worry.
17,Aceite de Oliva,3,Red table hope control.
47,Gofio,3,Eye tax stage analysis top sea.
93,Gofio,5,Remember money series.
69,Aceite de Oliva,5,Town thus happen break year.
99,Queso Majorero,4,Against everything culture form once behavior.
33,Dulce de Membrillo,3,Serious foot the Mr see college.
13,Vino Tinto Canario,2,South seek like.
65,Dulce de Membrillo,4,Watch off matter never.
35,Dulce de Membrillo,2,Eye mind from grow radio.
44,Dulce de Membrillo,4,Part allow star describe price case.
50,Aceite de Oliva,5,War which theory fear organization their vote.
